{
  "id": "d0e1f2a3-4567-4890-bcde-f0123456789a",
  "ownerEName": "@a1b2c3d4-5e6f-4789-a012-bcdef0123456",
  "videoId": "f2a6743e-8d5b-43bc-a9f0-1c7a3b9e90d7",
  "body": "Clear ownership and media references make this schema portable.",
  "visibility": "public",
  "createdAt": "2026-08-05T14:00:00.000Z",
  "updatedAt": "2026-08-05T14:00:00.000Z",
  "likeCount": 2,
  "replyCount": 0
}
